"Status","Start Time","Stop Time","Duration in ms","Parent Suite","Suite","Sub Suite","Test Class","Test Method","Name","Description"
"passed","Thu Jun 25 06:03:24 UTC 2026","Thu Jun 25 06:03:26 UTC 2026","2021","Drest Test Suite","Tests Drest.tn","Tests.CartTest","Tests.CartTest","testPagePanierCharge","testPagePanierCharge","Vérifie que la page panier se charge correctement"
"broken","Thu Jun 25 06:02:02 UTC 2026","Thu Jun 25 06:02:32 UTC 2026","30449","Drest Test Suite","Tests Drest.tn","Tests.ProductTest","Tests.ProductTest","testPrixProduitPresent","testPrixProduitPresent","Vérifie que le prix du produit est visible et non vide sur la page détail"
"broken","Thu Jun 25 05:59:56 UTC 2026","Thu Jun 25 05:59:56 UTC 2026","14","Drest Test Suite","Tests Drest.tn","Tests.HomePageTest","Tests.HomePageTest","testMenuPrincipalPresent","testMenuPrincipalPresent","Vérifie que les menus principaux Femme, Homme et Enfants sont visibles"
"failed","Thu Jun 25 05:59:58 UTC 2026","Thu Jun 25 05:59:58 UTC 2026","13","Drest Test Suite","Tests Drest.tn","Tests.HomePageTest","Tests.HomePageTest","testTitrePage","testTitrePage","Vérifie que le titre de la page d'accueil contient 'Drest'"
"broken","Thu Jun 25 06:00:14 UTC 2026","Thu Jun 25 06:00:25 UTC 2026","10148","Drest Test Suite","Tests Drest.tn","Tests.NavigationTest","Tests.NavigationTest","testNavigationEnfants","testNavigationEnfants","Vérifie que le clic sur le menu Enfants redirige vers la page enfants"
"broken","Thu Jun 25 06:01:27 UTC 2026","Thu Jun 25 06:01:58 UTC 2026","30457","Drest Test Suite","Tests Drest.tn","Tests.ProductTest","Tests.ProductTest","testClicProduitEtTitre","testClicProduitEtTitre","Vérifie que le titre du produit est visible et non vide sur la page détail"
"passed","Thu Jun 25 06:02:00 UTC 2026","Thu Jun 25 06:02:00 UTC 2026","51","Drest Test Suite","Tests Drest.tn","Tests.ProductTest","Tests.ProductTest","testPageCategorieCharge","testPageCategorieCharge","Vérifie que la page catégorie vêtements femme se charge correctement"
"broken","Thu Jun 25 06:03:29 UTC 2026","Thu Jun 25 06:03:59 UTC 2026","30452","Drest Test Suite","Tests Drest.tn","Tests.CartTest","Tests.CartTest","testPanierNonVideApresAjout","testPanierNonVideApresAjout","Vérifie que le panier contient bien le produit ajouté et n'est pas vide"
"broken","Thu Jun 25 06:00:39 UTC 2026","Thu Jun 25 06:00:49 UTC 2026","10152","Drest Test Suite","Tests Drest.tn","Tests.NavigationTest","Tests.NavigationTest","testNavigationHomme","testNavigationHomme","Vérifie que le clic sur le menu Homme redirige vers la page homme"
"broken","Thu Jun 25 06:01:15 UTC 2026","Thu Jun 25 06:01:25 UTC 2026","10151","Drest Test Suite","Tests Drest.tn","Tests.SearchTest","Tests.SearchTest","testRechercheVideSansResultat","testRechercheVideSansResultat","Vérifie qu'une recherche avec un mot inexistant affiche un message d'absence de résultats"
"broken","Thu Jun 25 06:00:02 UTC 2026","Thu Jun 25 06:00:12 UTC 2026","10168","Drest Test Suite","Tests Drest.tn","Tests.NavigationTest","Tests.NavigationTest","testNavigationBeaute","testNavigationBeaute","Vérifie que le clic sur le menu Beauté redirige vers la page beauté"
"broken","Thu Jun 25 06:00:27 UTC 2026","Thu Jun 25 06:00:37 UTC 2026","10161","Drest Test Suite","Tests Drest.tn","Tests.NavigationTest","Tests.NavigationTest","testNavigationFemme","testNavigationFemme","Vérifie que le clic sur le menu Femme redirige vers la page femme"
"passed","Thu Jun 25 06:00:00 UTC 2026","Thu Jun 25 06:00:00 UTC 2026","11","Drest Test Suite","Tests Drest.tn","Tests.HomePageTest","Tests.HomePageTest","testURLCorrecte","testURLCorrecte","Vérifie que l'URL de la page d'accueil contient 'drest.tn'"
"broken","Thu Jun 25 06:07:32 UTC 2026","Thu Jun 25 06:08:12 UTC 2026","40027","Drest Test Suite","Tests Drest.tn","Tests.LoginTest","Tests.LoginTest","testPageLoginCharge","testPageLoginCharge","Vérifie que la page de connexion charge correctement"
"broken","Thu Jun 25 06:01:03 UTC 2026","Thu Jun 25 06:01:13 UTC 2026","10143","Drest Test Suite","Tests Drest.tn","Tests.SearchTest","Tests.SearchTest","testRechercheValide","testRechercheValide","Vérifie qu'une recherche avec le mot 'adidas' retourne des résultats et redirige correctement"
"broken","Thu Jun 25 05:59:44 UTC 2026","Thu Jun 25 05:59:54 UTC 2026","10195","Drest Test Suite","Tests Drest.tn","Tests.HomePageTest","Tests.HomePageTest","testLogoPresent","testLogoPresent","Vérifie que le logo Drest est visible sur la page d'accueil"
"broken","Thu Jun 25 06:05:26 UTC 2026","Thu Jun 25 06:06:06 UTC 2026","40040","Drest Test Suite","Tests Drest.tn","Tests.LoginTest","Tests.LoginTest","testConnexionIdentifiantsInvalides","testConnexionIdentifiantsInvalides","KO - Vérifie qu'un message d'erreur s'affiche avec de mauvais identifiants"
"broken","Thu Jun 25 06:04:02 UTC 2026","Thu Jun 25 06:04:42 UTC 2026","40065","Drest Test Suite","Tests Drest.tn","Tests.LoginTest","Tests.LoginTest","testConnexionEmailFormatInvalide","testConnexionEmailFormatInvalide","KO - Vérifie qu'une erreur s'affiche avec un email au format incorrect"
"broken","Thu Jun 25 06:02:51 UTC 2026","Thu Jun 25 06:03:22 UTC 2026","30456","Drest Test Suite","Tests Drest.tn","Tests.CartTest","Tests.CartTest","testAjoutAuPanier","testAjoutAuPanier","Vérifie qu'un produit peut être ajouté au panier depuis la page catégorie"
"broken","Thu Jun 25 06:00:51 UTC 2026","Thu Jun 25 06:01:01 UTC 2026","10160","Drest Test Suite","Tests Drest.tn","Tests.NavigationTest","Tests.NavigationTest","testNavigationSport","testNavigationSport","Vérifie que le clic sur le menu Sport redirige vers la page sport"
"broken","Thu Jun 25 06:09:40 UTC 2026","Thu Jun 25 06:10:00 UTC 2026","20265","Drest Test Suite","Tests Drest.tn","Tests.E2ETest","Tests.E2ETest","testParcourNavigationRecherche","testParcourNavigationRecherche","E2E - Navigation menu → Recherche produit → Consultation fiche produit"
"broken","Thu Jun 25 06:06:08 UTC 2026","Thu Jun 25 06:06:48 UTC 2026","40015","Drest Test Suite","Tests Drest.tn","Tests.LoginTest","Tests.LoginTest","testConnexionIdentifiantsValides","testConnexionIdentifiantsValides","Vérifie qu'un utilisateur peut se connecter avec succès"
"broken","Thu Jun 25 06:02:34 UTC 2026","Thu Jun 25 06:02:49 UTC 2026","15261","Drest Test Suite","Tests Drest.tn","Tests.ProductTest","Tests.ProductTest","testProduitsPresents","testProduitsPresents","Vérifie que les produits sont visibles dans la page catégorie"
"broken","Thu Jun 25 06:06:50 UTC 2026","Thu Jun 25 06:07:30 UTC 2026","40051","Drest Test Suite","Tests Drest.tn","Tests.LoginTest","Tests.LoginTest","testConnexionMotDePasseVide","testConnexionMotDePasseVide","KO - Vérifie qu'une erreur s'affiche quand le mot de passe est vide"
"broken","Thu Jun 25 06:04:44 UTC 2026","Thu Jun 25 06:05:24 UTC 2026","40053","Drest Test Suite","Tests Drest.tn","Tests.LoginTest","Tests.LoginTest","testConnexionEmailVide","testConnexionEmailVide","KO - Vérifie qu'une erreur s'affiche quand l'email est vide"
"broken","Thu Jun 25 06:08:58 UTC 2026","Thu Jun 25 06:09:38 UTC 2026","40057","Drest Test Suite","Tests Drest.tn","Tests.E2ETest","Tests.E2ETest","testParcourConnexionInvalide","testParcourConnexionInvalide","E2E KO - Tentative connexion avec mauvais identifiants"
"broken","Thu Jun 25 06:08:14 UTC 2026","Thu Jun 25 06:08:54 UTC 2026","40052","Drest Test Suite","Tests Drest.tn","Tests.E2ETest","Tests.E2ETest","testParcourAchatComplet","testParcourAchatComplet","E2E OK - Connexion → Navigation → Ajout panier → Checkout"
